{
  "$schema": "http://json-schema.org/draft-07/schema#",
  "title": "UDS Component Implementation Reference",
  "description": "Per-component impl.json file. Powers the Implementation Reference details on the Code tab: example HTML, optional behavior notes, and categorized design-token references.",
  "type": "object",
  "properties": {
    "$schema": { "type": "string" },
    "jsFunc": {
      "type": ["string", "null"],
      "description": "Legacy-compatible behavior function name. Null for current Web Component implementations unless an archived component payload still references a function."
    },
    "jsFile": {
      "type": ["string", "null"],
      "description": "Legacy-compatible path to the JS file containing jsFunc, relative to uds-docs/. Null for current Web Component implementations."
    },
    "tokens": {
      "type": "object",
      "description": "CSS custom properties the component depends on, grouped by category. Common groups: Color, Font, Space, Border. Each group is an array of token names like '--uds-color-surface-main'.",
      "additionalProperties": {
        "type": "array",
        "items": { "type": "string" }
      }
    },
    "html": {
      "type": "string",
      "description": "The full HTML body shown in the 'Component File' tab and bundled into the ZIP download. Includes <!DOCTYPE>, <head>, <link> tags, and component example markup. Plain string — no template substitution."
    }
  }
}
