{
  "$schema": "../../schemas/impl.schema.json",
  "jsFunc": null,
  "jsFile": null,
  "tokens": {
    "Surface": [
      "--uds-color-surface-main"
    ],
    "Text": [
      "--uds-color-text-primary"
    ],
    "Border": [
      "--uds-border-radius-container"
    ],
    "Shadow": [
      "--uds-shadow-depth-300"
    ],
    "Space": [
      "--uds-space-100",
      "--uds-space-150",
      "--uds-space-200"
    ],
    "Font": [
      "--uds-font-family",
      "--uds-font-size-base",
      "--uds-font-weight-regular",
      "--uds-font-line-height-base"
    ]
  },
  "html": "<!DOCTYPE html>\n<html lang=\"en\">\n<head>\n  <meta charset=\"UTF-8\" />\n  <link rel=\"stylesheet\" href=\"uds/uds.css\" />\n</head>\n<body style=\"padding:80px;\">\n\n  <span class=\"udc-tooltip-wrapper\">\n    <button class=\"udc-button-secondary\">Hover me</button>\n    <span class=\"udc-tooltip\" role=\"tooltip\">This is a tooltip</span>\n  </span>\n\n</body>\n</html>"
}
