{
  "$schema": "../../schemas/impl.schema.json",
  "jsFunc": null,
  "jsFile": null,
  "tokens": {
    "Surface": [
      "--uds-color-surface-main",
      "--uds-color-surface-interactive-subtle-hover"
    ],
    "Text": [
      "--uds-color-text-primary",
      "--uds-color-text-secondary"
    ],
    "Icon": [
      "--uds-color-icon-primary",
      "--uds-color-icon-secondary",
      "--uds-color-icon-interactive"
    ],
    "Border": [
      "--uds-color-border-secondary",
      "--uds-border-radius-container-full",
      "--uds-border-radius-container-xl",
      "--uds-border-radius-input"
    ],
    "Space": [
      "--uds-space-025",
      "--uds-space-050",
      "--uds-space-075",
      "--uds-space-100",
      "--uds-space-150",
      "--uds-space-200",
      "--uds-space-250",
      "--uds-space-300"
    ],
    "Font": [
      "--uds-font-family",
      "--uds-font-size-base",
      "--uds-font-size-xl",
      "--uds-font-size-2xl",
      "--uds-font-line-height-base",
      "--uds-font-line-height-xl",
      "--uds-font-weight-medium",
      "--uds-font-weight-bold"
    ],
    "Shadow": [
      "--uds-shadow-depth-100"
    ]
  },
  "html": "<!DOCTYPE html>\n<html lang=\"en\">\n<head>\n  <meta charset=\"UTF-8\" />\n  <link href=\"https://fonts.googleapis.com/css2?family=Material+Symbols+Outlined\" rel=\"stylesheet\" />\n  <link rel=\"stylesheet\" href=\"uds/uds.css\" />\n</head>\n<body>\n\n  <div class=\"udc-nav-header\">\n    <div class=\"udc-nav-header__left\">\n      <div class=\"udc-nav-logo\"><span class=\"material-symbols-outlined\" style=\"font-size:32px;\">apartment</span></div>\n      <div class=\"udc-nav-title-area\">\n        <span class=\"material-symbols-outlined\">dashboard</span>\n        Boardroom\n        <span class=\"material-symbols-outlined udc-nav-title-area__chevron\">keyboard_arrow_down</span>\n      </div>\n    </div>\n    <div class=\"udc-nav-header__center\">\n      <div class=\"udc-nav-search\">\n        <span class=\"material-symbols-outlined\">auto_awesome</span>\n        <input class=\"udc-nav-search__input\" type=\"text\" placeholder=\"Search or ask a question\">\n      </div>\n    </div>\n    <div class=\"udc-nav-header__right\">\n      <div class=\"udc-nav-account\">\n        <button class=\"udc-button-ghost\" data-icon-only aria-label=\"Notifications\"><span class=\"material-symbols-outlined\">notifications</span></button>\n        <button class=\"udc-button-ghost\" data-icon-only aria-label=\"Settings\"><span class=\"material-symbols-outlined\">settings</span></button>\n        <button class=\"udc-button-ghost\" data-icon-only aria-label=\"Account\"><span class=\"material-symbols-outlined\">account_circle</span></button>\n      </div>\n    </div>\n  </div>\n\n</body>\n</html>"
}
