{
  "$schema": "../../schemas/impl.schema.json",
  "jsFunc": null,
  "jsFile": null,
  "tokens": {
    "Color": [
      "--uds-color-surface-main",
      "--uds-color-surface-subtle",
      "--uds-color-surface-interactive-default",
      "--uds-color-text-primary",
      "--uds-color-text-secondary",
      "--uds-color-text-interactive",
      "--uds-color-border-primary",
      "--uds-color-border-secondary",
      "--uds-color-border-outline-focus-visible"
    ],
    "Font": [
      "--uds-font-family",
      "--uds-font-size-base",
      "--uds-font-weight-medium"
    ],
    "Space": [
      "--uds-space-100",
      "--uds-space-150",
      "--uds-space-200",
      "--uds-space-300"
    ],
    "Border": [
      "--uds-border-radius-input",
      "--uds-border-radius-container-md"
    ]
  },
  "html": "<!DOCTYPE html>\n<html lang=\"en\">\n<head>\n  <meta charset=\"UTF-8\" />\n  <meta name=\"viewport\" content=\"width=device-width, initial-scale=1.0\" />\n  <link href=\"https://fonts.googleapis.com/css2?family=Material+Symbols+Outlined\" rel=\"stylesheet\" />\n  <link rel=\"stylesheet\" href=\"uds/uds.css\" />\n  <script type=\"module\" src=\"web-components.js\"></script>\n  <title>tabs</title>\n</head>\n<body>\n<udc-tabs selected-panel=\"overview\">\n  <udc-tab panel=\"overview\">Overview</udc-tab>\n  <udc-tab panel=\"details\">Details</udc-tab>\n  <udc-tab-panel panel=\"overview\">Overview content</udc-tab-panel>\n  <udc-tab-panel panel=\"details\">Details content</udc-tab-panel>\n</udc-tabs>\n</body>\n</html>"
}
