{
  "$schema": "../../schemas/impl.schema.json",
  "jsFunc": "initNavVertical",
  "jsFile": "uds/components/nav-vertical/nav-vertical.js",
  "tokens": {
    "Surface": [
      "--uds-color-surface-interactive-none",
      "--uds-color-surface-interactive-subtle-hover",
      "--uds-color-surface-interactive-subtle-active",
      "--uds-color-surface-interactive-active",
      "--uds-color-surface-interactive-default"
    ],
    "Text": [
      "--uds-color-text-primary",
      "--uds-color-text-inverse",
      "--uds-color-text-interactive",
      "--uds-color-text-interactive-hover",
      "--uds-color-text-disabled"
    ],
    "Icon": [
      "--uds-color-icon-primary",
      "--uds-color-icon-interactive",
      "--uds-color-icon-inverse",
      "--uds-color-icon-disabled"
    ],
    "Border": [
      "--uds-color-border-outline-focus-visible",
      "--uds-border-radius-input",
      "--uds-border-radius-container-full"
    ],
    "Space": [
      "--uds-space-075",
      "--uds-space-100",
      "--uds-space-150",
      "--uds-space-200"
    ],
    "Font": [
      "--uds-font-family",
      "--uds-font-size-base",
      "--uds-font-line-height-base",
      "--uds-font-weight-medium"
    ]
  },
  "html": "<!DOCTYPE html>\n<html lang=\"en\">\n<head>\n  <meta charset=\"UTF-8\" />\n  <link href=\"https://fonts.googleapis.com/css2?family=Material+Symbols+Outlined\" rel=\"stylesheet\" />\n  <link rel=\"stylesheet\" href=\"uds/uds.css\" />\n</head>\n<body>\n\n  <nav class=\"udc-nav-vertical\" aria-label=\"Main navigation\">\n    <button class=\"udc-nav-button\" aria-selected=\"true\">\n      <span class=\"material-symbols-outlined\">space_dashboard</span>\n      <span class=\"udc-nav-button__label\">Dashboard</span>\n    </button>\n    <button class=\"udc-nav-button\">\n      <span class=\"material-symbols-outlined\">book</span>\n      <span class=\"udc-nav-button__label\">Leasing / CRM</span>\n    </button>\n  </nav>\n\n  <!-- Without leading icons -->\n  <nav class=\"udc-nav-vertical\" data-leading-icons=\"false\">\n    <button class=\"udc-nav-button\" aria-selected=\"true\">\n      <span class=\"udc-nav-button__label\">Dashboard</span>\n    </button>\n  </nav>\n\n  <script src=\"uds/uds.js\"></script>\n</body>\n</html>"
}
