{
  "$schema": "../../schemas/impl.schema.json",
  "jsFunc": null,
  "jsFile": null,
  "tokens": {
    "Color": [
      "--uds-color-surface-main",
      "--uds-color-surface-subtle",
      "--uds-color-surface-interactive-default",
      "--uds-color-text-primary",
      "--uds-color-text-secondary",
      "--uds-color-text-interactive",
      "--uds-color-border-primary",
      "--uds-color-border-secondary",
      "--uds-color-border-outline-focus-visible"
    ],
    "Font": [
      "--uds-font-family",
      "--uds-font-size-base",
      "--uds-font-weight-medium"
    ],
    "Space": [
      "--uds-space-100",
      "--uds-space-150",
      "--uds-space-200",
      "--uds-space-300"
    ],
    "Border": [
      "--uds-border-radius-input",
      "--uds-border-radius-container-md"
    ]
  },
  "html": "<!DOCTYPE html>\n<html lang=\"en\">\n<head>\n  <meta charset=\"UTF-8\" />\n  <meta name=\"viewport\" content=\"width=device-width, initial-scale=1.0\" />\n  <link href=\"https://fonts.googleapis.com/css2?family=Material+Symbols+Outlined\" rel=\"stylesheet\" />\n  <link rel=\"stylesheet\" href=\"uds/uds.css\" />\n  <script type=\"module\" src=\"web-components.js\"></script>\n  <title>combobox</title>\n</head>\n<body>\n<udc-combobox\n  show-label\n  label=\"Apartment\"\n  placeholder=\"Search apartments…\"\n  leading-icon=\"search\"\n  value=\"riverbend\"\n>\n  <udc-combobox-option value=\"riverbend\">Riverbend Estates</udc-combobox-option>\n  <udc-combobox-option value=\"lakeside\">Lakeside Villas</udc-combobox-option>\n  <udc-combobox-option value=\"rolling-pines\">Rolling Pines</udc-combobox-option>\n</udc-combobox>\n</body>\n</html>"
}
