{
  "$schema": "../../schemas/impl.schema.json",
  "jsFunc": "initDropdown",
  "jsFile": "uds/components/dropdown/dropdown.js",
  "tokens": {
    "Color": [
      "--uds-color-surface-interactive-neutral",
      "--uds-color-surface-interactive-none",
      "--uds-color-surface-interactive-disabled",
      "--uds-color-surface-interactive-subtle-hover",
      "--uds-color-surface-interactive-subtle-active",
      "--uds-color-surface-white",
      "--uds-color-text-primary",
      "--uds-color-text-secondary",
      "--uds-color-text-interactive",
      "--uds-color-text-disabled-bold",
      "--uds-color-text-error",
      "--uds-color-icon-interactive",
      "--uds-color-icon-error",
      "--uds-color-icon-disabled",
      "--uds-color-border-primary",
      "--uds-color-border-interactive",
      "--uds-color-border-error",
      "--uds-color-border-disabled",
      "--uds-color-border-outline-focus-visible"
    ],
    "Font": [
      "--uds-font-family",
      "--uds-font-size-xs",
      "--uds-font-size-sm",
      "--uds-font-size-base",
      "--uds-font-line-height-xs",
      "--uds-font-line-height-sm",
      "--uds-font-line-height-base",
      "--uds-font-weight-regular",
      "--uds-font-weight-medium",
      "--uds-font-weight-bold"
    ],
    "Space": [
      "--uds-space-050",
      "--uds-space-100",
      "--uds-space-150",
      "--uds-space-200"
    ],
    "Border": [
      "--uds-border-radius-input"
    ]
  },
  "html": "<!DOCTYPE html>\n<html lang=\"en\">\n<head>\n  <meta charset=\"UTF-8\" />\n  <link href=\"https://fonts.googleapis.com/css2?family=Material+Symbols+Outlined\" rel=\"stylesheet\" />\n  <link rel=\"stylesheet\" href=\"uds/uds.css\" />\n</head>\n<body>\n\n  <div class=\"udc-dropdown\">\n    <label class=\"udc-dropdown__label\">Favourite fruit</label>\n    <div class=\"udc-dropdown__trigger\" tabindex=\"0\" role=\"combobox\"\n         aria-expanded=\"false\" aria-haspopup=\"listbox\">\n      <span class=\"udc-dropdown__leading-icon\">\n        <span class=\"material-symbols-outlined\">add_circle_outline</span>\n      </span>\n      <span class=\"udc-dropdown__value\" data-placeholder>Choose...</span>\n      <span class=\"udc-dropdown__chevron\">\n        <span class=\"material-symbols-outlined\">keyboard_arrow_down</span>\n      </span>\n    </div>\n    <div class=\"udc-dropdown__helper\"><span>Pick one fruit</span></div>\n    <div class=\"udc-dropdown__list\" role=\"listbox\">\n      <div class=\"udc-dropdown__item\" role=\"option\">Apple</div>\n      <div class=\"udc-dropdown__item\" role=\"option\">Banana</div>\n      <div class=\"udc-dropdown__item\" role=\"option\">Cherry</div>\n    </div>\n  </div>\n\n  <script src=\"uds/uds.js\"></script>\n</body>\n</html>"
}
